{"aggregate_sha256":"5393f2c2f9430f7a1bef98e45e9914af37a0b80fda2c86df4e8bdb234e4d7c66","attempt":1,"builder":{"blob":"e366dc29c028370544bb578f487e2342379cb1f6","commit":"8454c9c712eaeedb14381956ac6144fd42dfbe39","path":"scripts/build_ae_sq8_author_template.py","sha256":"cc0670f88a36cec9f8d04a17791dd7fbb50b3765ae6fff435b4a37b8873f458b","tree":"f12485bc43bc406c33ecebcd6a59628fb7f8f556"},"candidate_id":"AE-SQ8-SLEC-8","f1a_implementation":{"commit":"8454c9c712eaeedb14381956ac6144fd42dfbe39","tree":"f12485bc43bc406c33ecebcd6a59628fb7f8f556"},"f1b_freeze":{"blob":"7357225b6e20964c77c3ce5ac609dbae2600c7f5","commit":"fb1c3dee8b9e3aaa77c12ad387af090ab26e410f","path":"evals/ae-sq8/f1/repaired-freeze.json","sha256":"37a698d0f854df5357326cc9ebea5c13b4b7086dc52c6c693d8f5ea2f4051b57","tree":"86174492f72dc65fad1675d38cb59bf16a4b6a1a"},"full_f3_boundary_gate":{"fixture":"synthetic-zero-corpus-zero-model-closed-receipt","positive":{"all_checks_true":true,"model_calls":0,"status":"PASS"},"production_boundary":"_execute_f3_boundary","production_checks":"_f3_checks","production_one_shot_builder":"build_f3_record","red_missing_nested":{"error":"validation_receipt_validator_identity","status":"REJECTED"},"red_top_level_only":{"error":"validation_receipt_validator_identity","status":"REJECTED"},"red_wrong_nested_placement":{"error":"validation_receipt_validator_identity","status":"REJECTED"}},"model_calls":0,"positive_round_trip":{"production_loader":"_load_base_state","status":"PASS"},"program_id":"AE-SQ8","red_fixture":{"exception_class":"PreflightError","exception_message":"F1G receipt is not exact canonical UTF-8 JSON","mutation":"exact-canonical-receipt-plus-one-line-feed","status":"REJECTED"},"schema_version":"ae-sq8-author-template-gate-v1","selected_reference_anchor_gate":{"positive":{"status":"PASS"},"production_resolver":"resolve_expected_capsules","production_validator":"validate_corpora:selected_reference_anchors_valid","red_missing":{"error":"selected_reference_anchor","status":"REJECTED"},"red_wrong":{"error":"selected_reference_anchor","status":"REJECTED"}},"status":"PASS","template_sha256":"b34b11ad483ef5d4dbd300be7cd0b2651991bcb2025a2336fc9f70559a6db3eb","validator":{"blob":"f06920119b6a23e10f924847bcefbe3477937d53","commit":"8454c9c712eaeedb14381956ac6144fd42dfbe39","path":"scripts/validate_ae_sq8_corpus.py","sha256":"81ce10a7f22db7fa701db6242ea62b261b50a3d94382657807c56dd36cab40b6","tree":"f12485bc43bc406c33ecebcd6a59628fb7f8f556"}}